{
  "$schema": "../../.agents/skills/verify-loop/schemas/manifest.schema.json",
  "version": 1,
  "id": "phase-7",
  "title": "Phase 7 — Render-loop integration & frame orchestration",
  "description": "Adversarial verification profile for the current Phase 7 architecture document.",
  "targets": [
    {
      "path": "docs/phase7/v1/PHASE_7_DOC.md",
      "role": "document under review",
      "selectors": [
        {
          "id": "whole_document",
          "selector": {
            "start": "^# Schmaloogium — Phase 7:"
          }
        }
      ]
    }
  ],
  "authoritative_sources": [
    {
      "path": "docs/design/v2.0-RC3/DESIGN.md",
      "role": "governing design revision",
      "selectors": [
        {
          "id": "part_i",
          "selector": {
            "start": "^## Part I — Global sections$",
            "end": "^## Part II — Phase specifications$"
          }
        },
        {
          "id": "target_spec",
          "selector": {
            "start": "^### Phase 7 — Render-loop integration & frame orchestration$",
            "end": "^### Phase 8 — Shadow pass$"
          }
        },
        {
          "id": "doc_gate",
          "selector": {
            "start": "^\\*\\*Doc gate:\\*\\* every §7\\.1 hook need 1–11 traced to a hook-site spec, a Forge event, or an$",
            "end": "^\\*\\*Impl gate:\\*\\*",
            "end_mode": "first-after-start"
          }
        },
        {
          "id": "mandatory_template",
          "selector": {
            "start": "^## G9\\. PHASE_X_DOC\\.md — mandatory template$",
            "end": "^## G10\\. Open-question assignments$"
          }
        }
      ]
    },
    {
      "path": "docs/research/v1/RESEARCH.md",
      "role": "contract ground truth"
    }
  ],
  "supporting_evidence": [
    {
      "path": "docs/reference/pintonium/v1.0/PINTONIUM_DESIGN.md",
      "role": "Pintonium reference evidence"
    },
    {
      "path": "reference-src/pintonium-9c2fcc1/forge122/src/shaders/java/org/taumc/celeritas/mixin/shaders/MixinEntityRenderer_Shaders.java",
      "role": "Pintonium 1.12.2 entity-renderer injection-timeline evidence"
    },
    {
      "path": "reference-src/pintonium-9c2fcc1/forge122/src/shaders/java/org/taumc/celeritas/mixin/shaders/MixinRenderGlobal_Shaders.java",
      "role": "Pintonium 1.12.2 render-global injection-timeline evidence"
    },
    {
      "path": "reference-src/cleanroom-0.6.6-alpha/patches/minecraft/net/minecraft/client/renderer/EntityRenderer.java.patch",
      "role": "Cleanroom entity-renderer delta evidence"
    },
    {
      "path": "reference-src/cleanroom-0.6.6-alpha/patches/minecraft/net/minecraft/client/renderer/RenderGlobal.java.patch",
      "role": "Cleanroom render-global delta evidence"
    },
    {
      "path": "reference-src/schlorbium-HD_U_G6_pre1/SHADER_ENGINE_IMPL.md",
      "role": "OptiFine behavioral-observation digest for frame flow and lifecycle"
    },
    {
      "path": "reference-src/schlorbium-HD_U_G6_pre1/files.txt",
      "role": "OptiFine replacement-list cross-check evidence"
    }
  ],
  "dependencies": [
    {
      "path": "docs/phase2/v1/PHASE_2_DOC.md",
      "role": "dependency architecture and binding interface",
      "binding_contract": {
        "start": "^## 5\\. Cross-phase interfaces$",
        "end": "^## 6\\. Failure modes & degradation$"
      }
    },
    {
      "path": "docs/phase3/v1/PHASE_3_DOC.md",
      "role": "dependency architecture and binding interface",
      "binding_contract": {
        "start": "^## 5\\. Cross-phase interfaces$",
        "end": "^## 6\\. Failure modes & degradation$"
      }
    },
    {
      "path": "docs/phase4/v1/PHASE_4_DOC.md",
      "role": "dependency architecture and binding interface",
      "binding_contract": {
        "start": "^## 5\\. Cross-phase interfaces$",
        "end": "^## 6\\. Failure modes & degradation$"
      }
    },
    {
      "path": "docs/phase5/v1/PHASE_5_DOC.md",
      "role": "dependency architecture and binding interface",
      "binding_contract": {
        "start": "^## 5\\. Cross-phase interfaces$",
        "end": "^## 6\\. Failure modes & degradation$"
      }
    },
    {
      "path": "docs/phase6/v1/PHASE_6_DOC.md",
      "role": "dependency architecture and binding interface",
      "binding_contract": {
        "start": "^## 5\\. Cross-phase interfaces$",
        "end": "^## 6\\. Failure modes & degradation$"
      }
    }
  ],
  "prior_reviews": {
    "directory": "docs/phase7/reviews",
    "filename_regex": "^PHASE_7_REVIEW_(?<round>\\d+)\\.md$",
    "round_group": "round",
    "read_order": "adjudicator-last",
    "allow_gaps": false
  },
  "forbidden_sources": {
    "path_patterns": [
      "docs/**/chatlogs/**",
      "*.txt"
    ],
    "provenance_patterns": [
      "any prior agent or session transcript, regardless of path or extension"
    ]
  },
  "immutable_paths": [
    "docs/research/**",
    "docs/design/**",
    "docs/reference/**",
    "docs/phase2/v1/PHASE_2_DOC.md",
    "docs/phase2/reviews/**",
    "docs/phase3/v1/PHASE_3_DOC.md",
    "docs/phase3/reviews/**",
    "docs/phase4/v1/PHASE_4_DOC.md",
    "docs/phase4/reviews/**",
    "docs/phase5/v1/PHASE_5_DOC.md",
    "docs/phase5/reviews/**",
    "docs/phase6/v1/PHASE_6_DOC.md",
    "docs/phase6/reviews/**",
    "docs/phase7/reviews/*.md",
    "reference-src/pintonium-9c2fcc1/forge122/src/shaders/java/org/taumc/celeritas/mixin/shaders/MixinEntityRenderer_Shaders.java",
    "reference-src/pintonium-9c2fcc1/forge122/src/shaders/java/org/taumc/celeritas/mixin/shaders/MixinRenderGlobal_Shaders.java",
    "reference-src/cleanroom-0.6.6-alpha/patches/minecraft/net/minecraft/client/renderer/EntityRenderer.java.patch",
    "reference-src/cleanroom-0.6.6-alpha/patches/minecraft/net/minecraft/client/renderer/RenderGlobal.java.patch",
    "reference-src/schlorbium-HD_U_G6_pre1/SHADER_ENGINE_IMPL.md",
    "reference-src/schlorbium-HD_U_G6_pre1/files.txt"
  ],
  "write_permissions": {
    "adjudicator": [
      "{review_output}"
    ],
    "fixup": [
      "docs/phase7/v1/PHASE_7_DOC.md",
      "{review_output}"
    ]
  },
  "output": {
    "directory": "docs/phase7/reviews",
    "review_template": "PHASE_7_REVIEW_{round}.md",
    "journal_directory": ".verification-runs/phase-7"
  },
  "attack_lenses": "verification/lenses/phase-document.json",
  "lens_order": {
    "first_review": [
      "interfaces",
      "conformance",
      "doc-gate",
      "scope-decisions",
      "new-surface"
    ],
    "mature": [
      "new-surface",
      "interfaces",
      "conformance",
      "doc-gate",
      "scope-decisions"
    ]
  },
  "citation": {
    "format": "repo-relative-line-quote",
    "resolver": "line-quote",
    "allow_unique_relocation": true
  },
  "interface_regions": [
    {
      "id": "cross-phase-interfaces",
      "path": "docs/phase7/v1/PHASE_7_DOC.md",
      "selector": {
        "start": "^## 5\\. Cross-phase interfaces$",
        "end": "^## 6\\. Failure modes & degradation$"
      },
      "change_trigger": "A fresh verify round is required before Phase 7 can close."
    }
  ],
  "policy": "verification/policy.json",
  "target_context": {
    "assigned_open_questions": "OQ-3, OQ-4",
    "phase_name": "Render-loop integration & frame orchestration",
    "mandatory_section_count": 13
  },
  "fixup_instructions": "This is a first-version document with no mature fix-up-addendum convention. If a correction changes the target, add only a compact next-numbered §0 subsection using its existing header style; do not import Phase 1's supersession sentences, dated-claim ranges, or session-count bookkeeping. Keep full reasoning in the current review's Resolutions and do not roll the v1 directory during a loop."
}
